,time,ID,text,score,like,dislike,watch_movie
7779,17.02.05 12:43,민서맘(jsek****),뻔한얘기지만..현빈 멋짐.. ,8,2,1,TRUE
7780,17.02.05 12:31,rowlgns2(kkji****),너무 재밌고.액션과 코믹 최고였습니다 ,9,2,1,TRUE
7781,17.02.05 12:30,생각사랑(ia21****),"현빈의 액션, 유해진의 코믹 2시간이 그냥 간다 ",10,2,1,TRUE
7782,17.02.05 12:30,정대만이요요요요(jung****),짱 입니다  유해진 역시재미있구요 현빈  김주혁 역시신망시키지 안네요 ,10,2,1,TRUE
7783,17.02.05 12:29,안옥례(ok_r****),현빈 유해진 꿀재미 액션도 좋고 멋있네요 ,10,2,1,TRUE
7784,17.02.05 12:26,뾰롱마녀(yeon****),재미있어요..시간가는줄 모르고 봤습니당.. ,9,2,1,TRUE
7785,17.02.05 12:11,몰라(joy3****),나름 재미남  현빈을위한  영화  짱 멋지 ,9,2,1,TRUE
7786,17.02.05 12:05,dowk****,김주혁 정말 다시 보게 되는 영화네여 ㅎㅎ추천합니다 ,9,2,1,TRUE
7787,17.02.05 11:57,하오마루(item****),꿀재미있어요 근데 현빈만 너무 잘나게 만든거같음... ,8,2,1,TRUE
7788,17.02.05 11:57,bruno(inde****),"현빈의 액션씬, 특히 로프씬과 자동차 추격씬이 멋지다. 김주혁의 서늘한 연기도 감상 포인트. 그러나 유해진 캐릭터에 설득력이 없고 남북 공조의 개연성이 부족하여 스토리가 따분함. 코믹물도 아닌 액션물도 아닌, 뭔가 어정쩡하고 조화롭지 못한. ",6,2,1,TRUE
7789,17.02.05 11:47,조코비치(khmm****),왜 윤아는 납치 안된거지 갑자기 사라진 윤아... ,6,2,1,FALSE
7790,17.02.05 11:10,prepton(jink****),웃는 재미는 있었다만 영화 자체의 스토리 개연성은 극도로 떨어진다. 스토리는 그냥 기대 하지 말고 영화에서 나오는 현빈의 액션이나 감상하자. ,4,2,1,FALSE
7791,17.02.05 11:08,소나기와(hans****),유치할 줄은 알았지만 생각보다 꿀 잼.... ,8,2,1,FALSE
7792,17.02.05 10:51,lolo****,기대를 넘 많이했눈지 현빈만 보고왔네여ㅠㅠ생각보다 재밌지 않아요그냥 전우치가 생각나는건 왜일까욤 ㅠㅠ ,5,2,1,TRUE
7793,17.02.05 10:34,김영덕(ydki****),내용 전개가 자연스럽지 못하고 인위적이엇음 ,7,2,1,TRUE
7794,17.02.05 10:15,kyny****,시간 떼우기 좋은 영화~ ,7,2,1,TRUE
7795,17.02.05 10:15,델라(mrki****),현빈의 액션신과 김주혁의 악역연기는 일품.남북 이데올로기에 기댄 스토리와 대사는 진부하고 오글거림 ,6,2,1,FALSE
7796,17.02.05 9:18,sky3****,현빈을 위한 영화. 너무 멋있게 나온다ㅜ 임윤아의 개그감있는 연기도 좋았다. 영화끝나고 나오면 나도 모르게 북한말을 쓰고 있는게 함정 ㅎㅎ ,8,2,1,TRUE
7797,17.02.05 9:05,도키(doki****),재미있어요~~ 추천~~ ,7,2,1,TRUE
7798,17.02.05 9:03,미친강(silh****),현빈을 위해 만들어진 영화 ,8,2,1,TRUE
7799,17.02.05 2:04,blanket(joyb****),현빈 멋있고 김주혁 쩐다 ,8,2,1,TRUE
7800,17.02.05 1:40,이수하(lsha****),약간의 억지스러움은 있어지만 긴장감이 살아있어 끝까지 잼있게봤습니다 ,8,2,1,TRUE
7801,17.02.05 0:44,phon****,기럭지현빈?이게 전부ㅋ역시 최고 유혜진? ,8,2,1,TRUE
7802,17.02.05 0:32,yel2****,재미있는데 조금 길어요 ,8,2,1,TRUE
7803,17.02.04 23:43,김민섭(alst****),컨택트를 보고난 후 봐서 그런가 조금 유치했지만 유쾌하고 재밌는 영화였어요 ,8,2,1,TRUE
7804,17.02.04 22:59,이항재(eden****),"재미있었고, 틈틈히 감동도 있고 이상적이지만, 남북관계에 대해 또다른  아이디어를 준 영화였다. 추천함. ",8,2,1,TRUE
7805,17.02.04 22:56,이영은(yyeu****),현빈의 액션신은  멋진데  내용이 조금 따라가지 못하는듯...   아쉬운마음입니다 ,6,2,1,TRUE
7806,17.02.04 22:07,도라에몽(tjsw****),현빈 불사신이여? 내용도 너무뻔하구 ㅠㅜ 실망 ,3,2,1,FALSE
7807,17.02.04 21:52,아흙(hot6****),이딴것도 영화라고 참 ... 알바들 풀어서 평점 작작 올려라 ,3,2,1,FALSE
7808,17.02.04 21:05,쥬피터(jina****),"스토리 무난하게 재밌었지만 스펙터클함이나 긴장감이 좀 약한거 같애요 결말도 쏘쏘,, 예전 90년대에 많이 본 영화느낌,,현빈이 멋있어서 그나마 별셋이여.. ",6,2,1,TRUE
7809,17.02.04 16:49,앤썰(answ****),지금이 어느 시대인데 이런 영화를.. ㅋㅋㅋㅋ 배우가 아깝다 ㅠ 아..  영화 럭키 유해진과는 다르네..유해진 현빈 보러갔다가 김주혁만 보이네 김주혁 연기 정말 아깝다 ㅠ ,3,2,1,FALSE
7810,17.02.04 8:58,path****,추격과 액션 장면은 박수를! 스토리가 좀더 치밀했으면 좋았겠지만...그래도 볼만함^^~ ,8,2,1,FALSE
7811,17.02.04 1:46,Shind(cys6****),"현빈과 유해진의 의외의 조합이 신선했음..김주혁도 악역연기 좋았고 스토리는 별거 없었지만 액션이 화끈해서 좋았다.한국영화 특유의 억지감동,웃음코드가 없어서 그거 하난 괜찮았음..근데 마지막에 역시나 한국영화 전형적인 패턴은 나오더라;;킬링타임용으론좋음 ",8,2,1,FALSE
7812,17.02.04 1:31,마빡이(snk4****),액션왕 현빈 끝10자 10자 ,6,2,1,FALSE
7813,17.02.04 0:23,태자(myka****),"주연들 연기좋고, 내용도 평타이상 근데 끝이 좀 아쉬웠음 ",8,2,1,TRUE
7814,17.02.03 22:20,hihi****,김주혁말곤 볼게 없엇음 ,8,2,1,TRUE
7815,17.02.03 19:50,똘현(tjr9****),나쁘지않았습니다 ㅋㅎㅋ ,7,2,1,TRUE
7816,17.02.03 19:28,ODG(ehdr****),ㅈㅏ앙라나우욷우융오토튜맠릴 ,8,2,1,TRUE
7817,17.02.03 19:07,토토몬도매사업(kk48****),스트레스 한방에 해소되여ㅋㅋㅋ게다가 현빈이 액션을 이렇게 잘할줄이야..너무좋네요 ,8,2,1,TRUE
7818,17.02.03 14:23,gibo****,가족과 같이 보기 좋은 영화? ,8,2,1,TRUE
7819,17.02.03 13:54,김병욱(kbu8****),잘봤어요 10ㅈㅏ!! ,7,2,1,TRUE
7820,17.02.03 13:06,jjim****,현빈이 짱... 넘 멋있어요.. ,8,2,1,TRUE
7821,17.02.03 12:34,qudt****,너무 전형적인 한국영화 흐름이 없고 뻔한스토리 ,5,2,1,FALSE
7822,17.02.03 11:51,병장김현수(gree****),더 킹 보다는 재미있게 봤어요!!! 믿고보는 유해진 ,8,2,1,TRUE
7823,17.02.03 8:14,수동동(msy7****),현빈짱 ㅋㅋ현빈이 이렇게 멋있는 절 요번에 영화보고 첨 알았네요 심지어 연기도 꽤 함 김주혁이 연기는 더 잘하지만~재밋게 잘봤어요 ,10,2,1,FALSE
7824,17.02.03 7:37,NY(mero****),현빈의  액션이  눈호강하네요 옆에 팬클럽에서오셨는지  현빈 액션씬마다 단체로소리지르셔서  깜놀했습니다. ,10,2,1,FALSE
7825,17.02.03 7:27,살랑(pink****),현빈은 완전 멋있고 유해진은 완전 웃긴 영화! 가볍게 볼 수 있어서 좋았다. ,10,2,1,TRUE
7826,17.02.03 7:26,룰루랄라(ekwj****),진짜 말이 필요없다...진심으로 현빈 액션 개쩔었고 유해진은 재밌었다..현빈은 수염 길렀는데도 멋있다 그냥 멋있음 ,10,2,1,FALSE
7827,17.02.03 4:49,오혜수(ohs1****),너무재밌었음!가족과함께봐도굿 ,10,2,1,TRUE
7828,17.02.03 1:03,녹차라떼(rulu****),배우들 연기는 좋지만 스토리나 개연성이 조금 약한듯해서 아쉬움.. 근데 어느순간 임철령에게 푹빠져 헤어나오질 못함ㅋ 비주얼은 물론이고 맨몸을 던지며 보여주는 액션씬에 반해서 바로 또 예매함ㅋㅋ ,9,2,1,FALSE
7829,17.02.02 23:03,쉥뽕(apfj****),그냥 볼만하긴하는데 현빈멋지구나 그정도였어요.연휴기간 배급사의  파워로 인한 1워탈환 스멜이 ,7,2,1,FALSE
7830,17.02.02 23:02,MN(rood****),아...림철령... ,8,2,1,FALSE
7831,17.02.02 22:45,요시모토(node****),나름 괜찮게 보았습니다. ,7,2,1,FALSE
7832,17.02.02 22:28,박매화(sysy****),ㅎㅎ기대안하고봐서그른가ㅋㅋ재밋게봣당ㅎ ,8,2,1,TRUE
7833,17.02.02 20:54,박세미(psm7****),가족들이랑 보기 좋은 영화예요. ,7,2,1,TRUE
7834,17.02.02 20:46,무한도전(721m****),흔한유해진영화인거같네요 ,7,2,1,TRUE
7835,17.02.02 20:41,지얀이(flor****),웃기기도하고 스토리도있고 재밌어요 ,6,2,1,TRUE
7836,17.02.02 20:38,kidg****,현빈 넘 멋지고 설레였어요 ,8,2,1,TRUE
7837,17.02.02 20:28,drea****,추석특집 드라마 한편 본 듯.. 더킹이나 공조나 도찐개찐 ,5,2,1,FALSE
7839,17.02.02 19:18,정하나(hana****),현빈도 유해진도 너무 멋있었지만 김주혁의 새로운 모습을 본 영화!!!! 김주혁이 정말 기억에 남는 영화같음! ,8,2,1,FALSE
7840,17.02.02 19:08,kskj****,개연성을 제외한다면 볼만한 오락성 영화다. 김주혁씨 연기가 굿입니다~  딱 7점 ,7,2,1,FALSE
7841,17.02.02 18:42,안양진(jeck****),옆에서 여자친구가 현빈보고 웃기많네요..ㅎㅎ ,8,2,1,TRUE
7842,17.02.02 17:48,시작의끝(drea****),재밌긴한데 와 엄청 재밌다 이느낌은 아니고.. 애매하네요 ,8,2,1,TRUE
7843,17.02.02 17:19,Khaius(spec****),솔직히 나도 보고 나선 현빈이랑 유해잔만 떠올랐는데시간이 흐르니 김주혁 생각이 나네. 구탱이형 존나 멋있었어.. 악역이 그렇게 잘 어울릴줄이야... 이 영화는 솔직히 구탱이형이 절반은 캐리했다 본다. ,8,2,1,FALSE
7844,17.02.02 14:55,식e(euns****),그냥 볼만한 영화 윤아가 은근 캐리함 ㅎㅎ ,8,2,1,TRUE
7845,17.02.02 14:43,77eh****,유해진 현빈 케미 좋고 재미있네요~ ,8,2,1,TRUE
7846,17.02.02 14:38,ayoounii(only****),재밌어요 현빈 멋있고 유해진 역시 ,8,2,1,TRUE
7847,17.02.02 12:45,deat****,역시케미가굳입니다재밌습니다 ,10,2,1,TRUE
7848,17.02.02 12:34,옥영(sam9****),굿굿 연기갑입니다 진심! ,10,2,1,TRUE
7849,17.02.02 11:46,한도형(han4****),가족끼리 보기 딱좋은 액션오락영화였어요^^ ,10,2,1,TRUE
7850,17.02.02 11:43,민지원(min0****),진짜 한번보면 반하는 영화에요ㅜㅜ진짜 짱이에요 꼭보세요 ,10,2,1,FALSE
7851,17.02.02 11:42,bjlo****,추천 재미있어요!!! ,10,2,1,TRUE
7852,17.02.02 11:40,한도현(hdh8****),한국영화를 두번 보고 싶은 적은 처음이였여요 ,10,2,1,FALSE
7853,17.02.02 11:37,이지영(dldd****),스토리도 탄탄하고  액션신과 코미디신도 재미있고  배우들의 연기력도 돋보였고 기대했던만큼 재미있게 봤습니다 별5개론 부족 할것 같네요 ㅎㅎ 공조 대박나시길^^ ,10,2,1,TRUE
7854,17.02.02 11:37,홍금아(hka6****),완전재밌어서 주변사람에게 강추 ,9,2,1,TRUE
7855,17.02.02 11:26,naxo****,감동도 재미도 잡은 최고의 영화~!!그리고 현빈 너무 멋져용♥.♥ ,10,2,1,TRUE
7856,17.02.02 11:20,yes1****,유해진과 현빈의 합작역시 기대한대로 재밓었습니다!! ,10,2,1,TRUE
7857,17.02.02 11:13,김유진(tidl****),가족끼리 보러 가기 좋은 영화였습니다.유해진이 나오는 영화는 모두 유쾌하고 재밌는 영화여서 믿고 볼 수 있었습니다. 현빈도 액션영화랑 잘 어울려서 재밌게 봤습니다. ,10,2,1,TRUE
7858,17.02.02 11:01,파리댁(chan****),다시 보고 싶어요! 1000만  문제없다 ,10,2,1,FALSE
7859,17.02.02 10:53,choo****,영화를 그리 많이 본 건 아니지만 제 생애 최고의 영화가 아닌가 싶네요.  스트레스 확 풀었어요 ,10,2,1,FALSE
7860,17.02.02 10:51,__(rldu****),박근혜가 길라임을 고집한 이유를 여기서 알 수 있었습니다. ,10,2,1,FALSE
7861,17.02.02 10:45,rlad****,영화도 재밌고 눈도 호강하고 일석이조 ,10,2,1,FALSE
7862,17.02.02 10:42,Michael(ghdr****),재미있디요~재미있디말이디요 ,9,2,1,TRUE
7863,17.02.02 10:41,gia1****,현빈~~대박~유해진연기최고~~차량번호 69OO~~빵터집 ,10,2,1,FALSE
7865,17.02.01 22:49,특이한Cat(pory****),"기대를 너무 하고갔었나, 재밌긴 했는데 기대했던 정도는 아닌 것 같아여ㅠㅜ근데 현빈, 유해진보다 김주혁이 제일 멋있었어요...진짜 극중에서 연기도 제일 잘하신 것 같아요 윤아도 너무 예쁘고 귀여웠어여ㅜㅜ ",8,2,1,FALSE
7866,17.02.01 22:20,jb19****,역시 유해진 연기는 믿고 봅니다! ,7,2,1,TRUE
7867,17.02.01 20:56,미아(tnru****),공유와 유해진의 케미가 엿보였던 영화 갠적으로 볼만햇음 ,8,2,1,TRUE
7868,17.02.01 18:37,rm1212(rm08****),재미있었다. 특히 액션이 짱이였다 ,8,2,1,TRUE
7869,17.02.01 18:13,lovelyjjjjjj(jins****),현빈 하드캐리 & 가족과 즐겁게 볼만한 영화 ,7,2,1,TRUE
7870,17.02.01 18:01,스잔(wlsw****),유해진은 웃기고 현빈 존멋 ,7,2,1,TRUE
7871,17.02.01 16:57,진도리(ljkj****),단순한 오락영화 김주혁이 멋있네ㅋ ,7,2,1,FALSE
7872,17.02.01 16:56,sudo****, 볼만합니다 그냥 한국영화 ,7,2,1,TRUE
7873,17.02.01 16:52,봉이엄마(mos3****),잼나요. 액션도.. 좋고 배우도 좋고.. 요근래본것중 젤 잼났음. 더킹도 봐야겟음.. ,8,2,1,FALSE
7874,17.02.01 15:44,lili****,재미있게봤어요  유해진  모처럼 좋은역활좋았어요~ ,8,2,1,TRUE
7875,17.02.01 15:24,쑤우(suji****),부모님이랑 킥킥거리며 재밌게 봤어요 ㅋㅋ 현빈은 멋있고 유해진은 웃기고 ㅋㅋ 윤아는 감초 역할이었네요   부모님도 재밌으셨대서 기분좋게 잘보았네요 ~ ,8,2,1,TRUE
7876,17.02.01 15:18,사과(tkfk****),기대안하고 봤는데 재밌었어요!! 현빈액션연기에 놀라고 유해진 명불허전연기에 감탄하고 김주혁 악역연기에 깜놀했습니다! ,8,2,1,FALSE
7877,17.02.01 15:03,qwdas(love****),재밋습니다....ㅎㅎㅎㅎ ,8,2,1,TRUE
7878,17.02.01 14:34,리븐뀨(jdm1****),액션과스릴 재미좋았어요2탄 기대되네요 ,8,2,1,FALSE
7879,17.02.01 14:10,mein****,현빈 멋짐 터짐 이네요 액션을 그렇게 잘할수가.. ,8,2,1,TRUE
7880,17.02.01 13:55,별따라기z(qkqn****),덤앤더머같은 느낌이지만 환상의커플처럼 너무 잘어울리고 극중 캐릭터들을 너무 잘 살려서 참 감동있게 봤어요^^ ,8,2,1,TRUE
7881,17.02.01 13:48,태양바라기(leeb****),너무 재미있넝 ㅋ혼자가서봐서 좀  ㅎ  더킹도보러갸지 현빈 멋있네요 ,8,2,1,TRUE
7882,17.02.01 13:46,mgo1****,남북한이 언제쯤 실질적인 공조수사 같은 것을 할 수 있을까??? ,8,2,1,TRUE
7883,17.02.01 13:35,릴리따(suuz****),유해진의 유쾌한 코믹연기.재밌었어요 ,7,2,1,TRUE
7884,17.02.01 13:06,자클린(resd****),줄거리는 뻔하지만 배우들의 뛰어난 열연에 볼만 했습니다 ,8,2,1,TRUE
7885,17.02.01 12:44,장선미(tjsa****),유쾌하게 잘 봤습니다현빈액션연기 너무 멋있네요 ,8,2,1,TRUE
7886,17.02.01 12:40,ttjs****,오랫만에본영화인데재밌게잘봤어요 ,7,2,1,TRUE
7887,17.02.01 12:38,최희정(choo****),유해진과현빈의브로맨스가제법잘어울렸던영화..!! ,8,2,1,TRUE
7888,17.02.01 12:38,행복(pst5****),럭키 이후에 또 기대가 되는 작품 공조 ~ 시간이 나지 않아 미루다가 심야로 남편과 딸아이 셋이 피곤함을 잊고 너무도 즐겁게 관람했어요 현빈 역쉬 짱짱 넘 멋지구요 유해진씨 코믹이 훨씬 잘 어울리는 배우인듯요 김주혁씨도 이번에 큰 느낌을 주셨네요ㅎ ,8,2,1,TRUE
7889,17.02.01 12:26,nick****,재밌게잘봤습니다 ㅎㅎㅎㅎ ,7,2,1,TRUE
7890,17.02.01 11:42,권민주(minj****),코믹도 있고 감동도 있는 영화!  실망시키지않네요 ,8,2,1,TRUE
7891,17.02.01 11:36,아틀란타(goek****),대충 볼만한 영화..500만 영화? ,8,2,1,TRUE
7892,17.02.01 10:59,hyeb****,현빈이 너무 멋있어서 우와... 감탄사 나오더라구요 그냥 가볍구 재밌게 볼법한 영화에요 추천! ,8,2,1,TRUE
7893,17.02.01 10:55,하(hana****),액션이 멋있네요. 눈이 즐거워지는 영화입니다. ,6,2,1,TRUE
7894,17.02.01 9:22,v물병자리v(dpcy****),그냥 보기에 무난하네여 ,7,2,1,TRUE
7895,17.02.01 6:35,flow****,약간  뻔한스토리이긴하지만 전혀지루하지않았고 재미있게 잘 봤습니다~^^김주혁.현빈.유해진 역시 명품연기자들 !! ,8,2,1,TRUE
7896,17.02.01 2:26,브래니트(eagl****),항구가기전까진 존잼이었다 ,7,2,1,TRUE
7897,17.02.01 0:37,seun****,뻔한스토리지만 디테일이 살아있는 영화윤아의 재발견 ,10,2,1,TRUE
7898,17.01.31 23:40,개두섭(shin****),역시 국산영화..끝내용이 좀아설퍼요 ㅠㅜ ,8,2,1,TRUE
7899,17.01.31 23:02,남궁은지(nkeu****),현빈을위한영화후반부가 약간아쉬웠어요 ,5,2,1,TRUE
7900,17.01.31 22:13,miyo****,좀 지루한 점도 있지만 유해진의 코믹 연기 현빈의 시종일관 액션 연기 넘 좋았구요 특히 윤아의 연기가 짱~ ,8,2,1,TRUE
7901,17.01.31 21:57,별크림(vnzk****),괜찮아요~재밌어요~ ,8,2,1,TRUE
7902,17.01.31 21:57,qkrw****,현빈 보다가 기절할뻔ㅋㅋㅋㅋ진짜 너무 멋있어요 현빈 밖에 안남음... 현빈.... ,10,2,1,FALSE
7903,17.01.31 21:54,배준규(sosh****),잼있 습니다ㅋ현빈이 멋져요 ,8,2,1,TRUE
7904,17.01.31 21:51,syjeuion(7539****),더킹. 공조 둘다 본 입장에서 소재의 중요성과 봐야하는 필요성은 더킹이 더 크지만 재미와 영화라는 작품성은 공조가 더 큰것같다 ,9,2,1,FALSE
7905,17.01.31 21:49,chun****,제법 볼만한 영화 입니다. 액션도 괜찮고 추천합니다. 다만 악당 대장이 질질끌다가 자기가 당하는 너무 전형적인 모습이라 그게 좀 진부하네요. ,8,2,1,FALSE
7906,17.01.31 21:44,권민지(gomm****),최근에 봤던 영화중에 젤 재밌엇어요 긴장감에 웃음까지 ,10,2,1,TRUE
7907,17.01.31 21:44,다이아몬드쏭(cham****),넘 재미 있게 본 영화 굿 입니다 ,10,2,1,FALSE
7908,17.01.31 21:43,naeu****,완전 재밌었어요~현빈씨 유해진씨  환상적인 조화였어요~가족들과 간만에 즐겁게 감상했습니다^^ ,10,2,1,TRUE
7909,17.01.31 21:41,wjdd****,웃기고재밌고 현빈존잘러..♥ ,10,2,1,FALSE
7910,17.01.31 21:39,전주ACE남자(whtk****),재미있게 관람했습니다. ,10,2,1,TRUE
7911,17.01.31 21:36,ting****,재밌는영화입니다굿굿 ,10,2,1,TRUE
7912,17.01.31 21:34,이정은(dlwj****),"현빈 역대급영화 왠만하면 평점잘안남기는데 정말 이번영화역대급 !!!진짜!!! 두번보고 세번볼꺼에요진짜ㅠㅠㅠㅠ 모든 씬이,, 감동 웃음 다있는데 다필요없고현빈이 멋있고 잘생긴영화,, ",10,2,1,FALSE
7913,17.01.31 21:26,사카모리(shbw****),현빈 개 멋있고 유해진은 개웃김 ,10,2,1,FALSE
7914,17.01.31 21:19,지나갑니다1(m9so****),현빈 쩔어 ㅠㅠ 개멋짐♡ ●잼나용^ ^ ,9,2,1,FALSE
7915,17.01.31 21:17,stella(wink****),"보는 내내 몰입도 좋고, 어찌보면 뻔할수 있는 스토리에 배우의 연기와 곳곳에 터지는 유머의 요소 + 심장 쫄깃해지는 빠른전개의 액션 덕에 . 이 영화는 a must see 가 되었음! 아..현빈.. 심장뛰게하는구나 ",9,2,1,FALSE
7916,17.01.31 21:14,zine****,현빈밖에 기억 안남. 그것 하나로도 9점 드릴수 있음 ,9,2,1,TRUE
7917,17.01.31 21:13,대한민국만세(indr****),영화 내용도 잘생기고 유해진 현빈도 잘생기고 ...  정말 재밌었다. ,10,2,1,TRUE
7918,17.01.31 21:12,김영희(kmh3****),잔잔한  강동을 주는 영화다 ,10,2,1,FALSE
7920,17.01.31 21:08,happ****,재밌습니다 영화 시간가는줄 몰라요 ,10,2,1,TRUE
7921,17.01.31 21:06,계영배(typh****),짐작한대로 진행되지만 지루하지않은 재미난 영화. ,9,2,1,TRUE
7922,17.01.31 21:06,V아엠수정V(tnwj****),믿고보는 유해진!!!! ,9,2,1,TRUE
7923,17.01.31 20:56,dmscks7(whwo****),영화가 재미있고 현빈이 잘생겼고 유해진 치명적?? ,9,2,1,TRUE
7924,17.01.31 20:53,lcan****,웃기고 재밋어용 가볍게 보기좋아요 ,10,2,1,TRUE
7925,17.01.31 20:51,good****,스피드와 액션이 감동입니다 현빈 액션 완전 멋지고 유해진 연기는 완전 최고입니다 ,10,2,1,FALSE
7926,17.01.31 20:50,tjdw****,완젼 재미잇엇습니다다음에도 재밋는 작품들 기대하겟습니다 ,10,2,1,TRUE
7927,17.01.31 20:48,다다이마(pido****),오랜만에 스트레스 제대로 풀어주는 영화였습니다현빈 유해진 출연 역시 믿고 볼수있는 영화네요~^^ ,9,2,1,TRUE
7928,17.01.31 20:46,znzn****,부모님과  보기에 딱인영화. 갓현빈과 참바다씨의 연기력에 다시한번 감동받았습니다. 너무 재밌게 잘 봤네요 ,9,2,1,TRUE
7929,17.01.31 20:45,전윤주(broo****),존잼ㅠㅠㅠ살면서 처음으로 극장가서 두번 본 영화 ,10,2,1,FALSE
7930,17.01.31 20:38,kum1****,부모님 보여드렸는데  재밌다고 좋아하셨어요~ ,10,2,1,TRUE
7931,17.01.31 20:35,챙이(ckdw****),임윤아 너무 웃겼어요ㅋㅋㅋㄱ ,10,2,1,TRUE
7932,17.01.31 20:34,뽀미(demi****),유해진 믿고 봤어요 잼나게 봤습니다 가볍게보세요!!!^^ ,10,2,1,TRUE
7933,17.01.31 20:24,dkdk****,코믹도 액션도 비주얼두 굉장히 재미있게 봤습니다10점드려도 충분해요 잼나요 ㅎㅎ~ ,10,2,1,TRUE
7934,17.01.31 20:23,csh3****,힘들었던 명절을 공조와 함께해서 즐거웠습니다 ,10,2,1,TRUE
7935,17.01.31 20:22,형규어(ehg2****),꿀잼 믿고보는 유해진 현빈 ,10,2,1,TRUE
7936,17.01.31 20:21,lj40****,개인적 견해입니다~지금까지 내가 본 한국 영화중 최고였습니다. ,9,2,1,TRUE
7937,17.01.31 20:20,daks****,너무.재미있고 .꺄!현빈정말멋있음ㅠ ,9,2,1,TRUE
7938,17.01.31 20:11,ksy9****,굿국굿 현빈연기짱!! ,10,2,1,TRUE
7939,17.01.31 20:06,현지닝(monh****),ㅎㅎㅎㅎ남주들 재밋음ㅋ_ㅋ ,10,2,1,TRUE
7940,17.01.31 20:02,77윤지맘(yass****),주인공 현빈~너무멋지고 유해진과의 호흡도 너무좋고모든배우들이 각자자리에서 맡은연기를 넘잘해서 영화에 재밌게몰입해보았네요!강추하고싶네요^^♥ ,10,2,1,TRUE
7941,17.01.31 19:54,esk8****,모든 배우들 연기 훌륭해요ㅎ 윤아는 코믹이 맞네요ㅎㅎ ,10,2,1,TRUE
7942,17.01.31 19:45,dbsk****,너무 재미있었고 추천하고 싶은 영화에요 ,10,2,1,TRUE
7943,17.01.31 19:43,별님(msum****),배우들의 혼신의 연기가 너무 멋져요~~ ,9,2,1,TRUE
7944,17.01.31 19:34,soce****,조조 관람!! 현빈의 잘 생긴 얼굴 보며 기분 좋은 하루 보냈습니다. 유해진씨는 일상처럼 연기가 너무 자연스러웠고 김주혁씨의 연기 오랜만에 보니 반가웠습니다~^^ ,9,2,1,TRUE
7945,17.01.31 19:27,chor****,"더킹을 이길 정도의 작품이 절대 아닌데, 설연휴 및 방학에 가족들이 함께 보기에 더킹보다 공조가 더 대중적이기 때문에 얻어걸린 듯. 가족들이 이해하기엔 딱 이정도라 이거지. 평론가 평점 봐라. ",4,2,1,FALSE
7946,17.01.31 19:21,김진호(gysk****),재밋게 봤습니다.스토리가 넘좋앗어요 ,10,2,1,TRUE
7947,17.01.31 19:19,완소상호(he89****),여친이랑 재미있게 보았네요 ^^ ,10,2,1,TRUE
7948,17.01.31 19:16,daeg****,화끈한액션 스토리도 탄탄! ,8,2,1,TRUE
7949,17.01.31 19:05,왕자(blue****),지루하고 뻔한 스토리...김주혁의 악역이 괜찮았음.. ,3,2,1,FALSE
7950,17.01.31 19:04,가화(0113****),현빈 멋있음 현빈 멋있음 현빈 멋있음 현빈 멋있음 ,8,2,1,TRUE
7951,17.01.31 19:04,이유림(lele****),진짜재미있었어요!! ,9,2,1,FALSE
7952,17.01.31 18:54,미아랑(kmia****),솔직히 지루하다... ,2,2,1,FALSE
7953,17.01.31 18:53,altjd(aaaa****),재밌어요 더킹보다 재밋는듯 ,9,2,1,TRUE
7954,17.01.31 18:52,chym****,현빈 완전 멋지고 유해진 믿고 보는 영화!! ,10,2,1,TRUE
7955,17.01.31 18:51,대동사랑(osta****),오랜만에 재밌는 영화  만나고 왔네요현빈  액션씬 넘 멋져요 ,10,2,1,TRUE
7956,17.01.31 18:41,pobi****,"이주 재밌었음.현빈의 액션도 좋았고,김주혁의 연기도 인상깊었다.유해진은 말할것도 없고~~~ ",10,2,1,TRUE
7957,17.01.31 18:33,김혜진(bn_h****),설 연휴 동생이랑 함께 봤는데 너무 재밌게 봤어요! 영화 끝나고 나와서 계속 공조 얘기만 한 것 같아요 ㅋㅋ  유해진 배우님과 현빈 배우님의 캐미도 최고였고 다른 배우분들 연기도 최고였던 영화! 완전 강추입니다! ,10,2,1,TRUE
7958,17.01.31 18:32,lene(dbdn****),킬링타임으로 보기 딱 좋은 영화인듯! ,10,2,1,TRUE
7959,17.01.31 18:28,ghos****,오락영화로서 재밌는 부분도 있지만 전형적인 한국 상업오락영화의 문제점 뭐든지 과하다 재미를 유발하려고 한 부분은 이해하지만 너무과해 좀 진짜 손발오글거리게좀 만들지마 난 개인적으로 더킹도 조금 별로였지만 이건 더킹보다 훨씬 별로였다 ,6,2,1,FALSE
7960,17.01.31 18:01,카산드라(t_bo****),보면서 느낀게 이 영화는 유해진이 살렸다고 봐야하는데 스토리 전개가 넘나 진부함. 뻔한 스토리. 미션임파서블을 약간 흉내낸 B급영화. ,6,2,1,FALSE
7961,17.01.31 17:56,Cherry(iamm****),명절에 가족들과 함께 보기 좋은 유쾌한 영화 ,8,2,1,TRUE
7962,17.01.31 17:37,하레v(hare****),마무리가 조금 아쉬운 괜찮은 오락영화. ,8,2,1,TRUE
7963,17.01.31 17:28,예지사랑(yjin****),주인공이 김주혁이였나 싶게 김주혁 임윤아 몇컷 안나오지만 웃김 ㅋ 감독이 지루하지않게 연출 잘한듯~ ,8,2,1,TRUE
