,time,ID,text,score,like,dislike,watch_movie
2267,17.03.01 4:50,타란티노(jjda****),"7년전 개봉한 아저씨의 원빈을 계승한 듯 하지만, 그보다도 올드하고 진부하며 신파적이어서 아, 허접한 연출이 명품배우 두명을 그냥 골로 보낼 수도 있구나 하는걸 알았다. ",2,3,0,FALSE
2268,17.03.01 4:13,여행중독(meta****),허술한 스토리를 유해진이 이리뛰고 저리뛰고 메꾸는데~ 감당하지 못하는  그저그런 영화. 유해진과 현빈의 캐스팅을 빼면 뭐가 남는가 곰곰히 다시생각해보라. ,6,3,0,FALSE
2269,17.02.28 22:48,히로(n_ew****),기대안하고보면 재밌음 ,5,3,0,FALSE
2270,17.02.21 16:38,PKD(jkw0****),순전히 재미를 위한 유치한 영화. 아이들을 겨냥한듯 ,6,3,0,FALSE
2271,17.02.21 8:38,kysc****,딱 킬링타임용ㅋㅋ한국액션영화는 제발 납치 좀 그만 했으면 좋겠다 ㅋㅋ ,6,3,0,FALSE
2272,17.02.21 0:37,수니민(rosa****),현빈을 위한 영화 ㅎㅎ 스토리 전개 너무 끄는듯 ,6,3,0,TRUE
2273,17.02.18 0:29,yung****,집에서 볼만한 영화도못됨. ,2,3,0,FALSE
2274,17.02.17 23:46,사과(lsy3****),뭐 그럭저럭 볼만했던것도 같은데 그렇게 꿀잼도 아니고 카피영화라니;; ,3,3,0,TRUE
2275,17.02.17 21:15,임채욱(codn****),초반 노잼 중반 잼 마지막 지루 ,6,3,0,TRUE
2276,17.02.17 20:24,uouo22(jsil****),억지로 보다가 나옴 ㅠㅠ의형제랑 비슷한것같기도 하고... ,3,3,0,FALSE
2277,17.02.15 17:21,ㅇㅇ(jeon****),재미있어요유해진짱현빈잘생김 ,3,3,0,TRUE
2279,17.02.15 12:46,수다쟁이(cool****),현빈님 넘 멋졌어요.하지만 전체적인 내용이 ㅎ ,6,3,0,TRUE
2280,17.02.15 0:40,하늘이참맑네(kks7****),잘봤습니다 영화! ㅎㅎ ,2,3,0,FALSE
2281,17.02.14 21:08,문쏭ㅡㅇ(cnnm****),원빈이 그나마 잘 흡수해서 다행이였다.. ,4,3,0,FALSE
2282,17.02.14 20:58,나라개판(gotn****),이번만큼은 기자 평론가의 말을 들었어야했는데 ;; 아침부터 맥 빠졌다 ,3,3,0,FALSE
2283,17.02.14 20:14,jing****,그냥 액션영화.스토리는 없는.. ,6,3,0,TRUE
2284,17.02.14 19:40,라디(la_d****),이게 어떻게 8.5나 되지... 진짜 개연성 개부족함 갑자기 현빈이랑 유해진 개친해지고 서로 목숨바침 ,2,3,0,FALSE
2285,17.02.14 2:21,chub****,그닥;;; 매력을 못느꼈네요;; ,4,3,0,TRUE
2286,17.02.14 1:10,마린보이(yang****),소문 듣고 혹시나 해서 갔는데 ... 답이 없네요. 내가 이상한것인가? 개인적으로 뻔한 스토리에 슈퍼맨 현빈 만들기 네요 ,4,3,0,FALSE
2287,17.02.13 22:17,어굴뉴(yhok****),액션은 나쁘지 않은데 스토리가 전혀 개연성이 없고 골때린다... ,4,3,0,FALSE
2288,17.02.13 16:14,gatsby(akax****),스토리의 개연성은 약하다. 액션도 글쎄. 유해진도 생각보다 빵빵 터뜨리진 못한다. 윤아가 더 웃길 정도 ,5,3,0,TRUE
2289,17.02.13 9:21,JOO(york****),가볍게 볼수 있는 영화지루하지 않지만 큰 기대는 안하는게 좋음! ,7,3,0,TRUE
2290,17.02.13 0:35,은하수(haha****),나름재미있었어요^^ ,8,3,0,TRUE
2291,17.02.13 0:18,오예성(rica****),가볍고 재밌게 보기 너무 딱인듯 하네요~~~ 우울한 부분도 없고 엔딩도 다 해피엔딩이라 좋네요 ㅎ ,8,3,0,FALSE
2292,17.02.13 0:02,고르딸(zzub****),아저씨처럼 복수감에 타오르는 진지한  것을 기대했는데 ㅠㅠ 코믹액션이였구나/... ,8,3,0,FALSE
2293,17.02.12 22:44,키득키득(cjy7****),넘나 재밋어영~~~~!!!역시 현빈이짱이에여♥♥ ,8,3,0,TRUE
2294,17.02.12 0:23,요지경(vyek****),졸면서 봤다 재밌다 현빈 잘생겼다 ,6,3,0,TRUE
2295,17.02.10 8:42,smil****,재미있긴 한데  이야기의 전개나 액션들이 너무 전형적인 것 같아서 약간 식상한 정도. ,7,3,0,TRUE
2296,17.02.10 1:17,timi****,겉 포장은 메이딩 코리아  속은  헐리웃   액션스러운액션다운  영화  생각없이 봐라  그럼 보일것이다진지하게 보면  답답하다 .... ,7,3,0,FALSE
2297,17.02.09 12:34,피아졸라(piaa****),다이하드.리쎌워폰...이리저리 어설픈 모방~빈약한 스토리...그냥 현빈 cf모음집 보고옴 ,5,3,0,FALSE
2298,17.02.09 9:50,Holic(star****),영화자체로는 그냥그런영화 솔직히 현빈빠 아니면 영화관에서 보기 돈아깝습니다 ,6,3,0,FALSE
2299,17.02.09 1:05,똥투더다(gyp0****),더킹이 더 재밌엇어여 뻔한 한국영화ㅠ ,5,3,0,TRUE
2300,17.02.08 16:01,boni****,"별 두개 이상 못주겠는 내가 이상한건가? 현빈 빼고는 그 누구의 연기력도 볼게 없고  내용도 뒤로 갈수록 넘 진부해서,,,영화보고 나서  ""네이버 평점에도 알바 푸나,,,?"" 라는 생각 들었음 ",4,3,0,FALSE
2301,17.02.08 15:00,하사장(boxe****),현빈만 멋잇네 줄거리는 뻔함 ,5,3,0,FALSE
2302,17.02.08 10:27,eric****,"박평식 평론가의 말을 빌려오겠다. 딱 맞는 표현이라서. &#39;허풍과 억지의 찰떡 공조&#39; -&gt;이게 정답이다. 현빈과 유해진의 열연으로 그나마 6점이나 주지만, 어설픈 남북정상회담과 억지스러운 납치, 의리, 액션...이건 좀 아니다. ",6,3,0,FALSE
2303,17.02.08 2:25,mr(wolf****),"- 현빈 액션 4,5/5- 유해진 연기  : 3,5/5 (중간중간 어색하고  힘듦)- 김주혁  연기 : 4.9/5- 스토리 : 0.5/5- 편집 및 연출 : 2/5- 총평 : 집에 친구들 놀러왔을 때, 치킨 시켜놓고 보는둥 마는둥 할만한 영 ",4,3,0,FALSE
2304,17.02.08 2:11,MaisonMartinMargiela(se68****),내 나라도 하나 제대로 건사도 못 하는데 무슨 남북한 공조를 들먹거리나? ,4,3,0,FALSE
2305,17.02.07 23:13,Minmin(stay****),"아침드라마 본 느낌. 평점이 왜이렇게 높냐;; 액션씬 빼고는 진짜 볼거없음. 오글거리고, 웃기지도않고.. 솔직히 다른영화에서 웃긴장면나오면 영화관 전체에서 사람들 웃는소리 들리는데, 이 영화는 2시간내내 조용했음. ",2,3,0,FALSE
2306,17.02.07 0:24,중국자취생(ghd6****),"어디서 본듯한 영화였다. 볼영화가 없어서 봤는데, 킬링타임용으론 무난한것같다. ",7,3,0,FALSE
2307,17.02.06 23:26,alsrb3812(ilck****),"중후반 뻔한 스토리에 질리는, 질긴 액션신현빈, 유해진은 언제나 그렇듯 캐릭터 좋았고윤아가 감초역할을 할줄이야. ",5,3,0,FALSE
2308,17.02.06 20:40,kbeb****,재미있게 잘봤습니다. 현빈 짱 ,7,3,0,TRUE
2309,17.02.06 15:24,ss(ksh0****),한국영화의 미래를 생각하고 마켔팅을 할것.아무리 돈만벌면 최고라지만 이건 아닌것 같네요..이걸 영화라고 점수를 주는 사람들 너무들 하네요 참고로 심야영화로 보고 나오면서 집사람하고 보통이면 영화평을 하는데 이건뭐 ..둘다 할이야기가 없어서 ,5,3,0,FALSE
2310,17.02.06 14:14,낭만카레(legr****),"액션은 아저씨, 용의자 보다 못한 정도...간간히 웃겨 주는 코믹을 제외하고는 이렇게 흥행이 된 점이 의문입니다. ",6,3,0,FALSE
2311,17.02.06 13:53,kuru****,액션인데 이렇게 긴장감없고 지루하기도 힘들듯~ ,4,3,0,FALSE
2312,17.02.06 12:52,하늘바라기(ekdh****),괜찮은 한국영화정도.... ,7,3,0,TRUE
2313,17.02.06 11:00,박경애(kyen****),현빈 넘 멋있구 유혜진도 넘 재밌구  ㆍ볼만 합니다 ^^ ,7,3,0,TRUE
2314,17.02.06 10:32,얌천사(yamm****),기대한만큼 실망도 큰 작품 ,7,3,0,TRUE
2316,17.02.06 8:54,정미순(galg****),액셔외에는. 별 재미없습니다.  스토리는 아주 평이하게 생각할 수 있는 정도...  현빈 슈트입은 모습은 짱! ,5,3,0,FALSE
2317,17.02.06 3:03,사색하는아멜리에(1phi****),"난 별로,, 더킹이 난더 잼있던데,, 유치,, 관객들 수준이 그렇지머~ ",7,3,0,FALSE
2318,17.02.06 2:55,GYEAH(dppd****), 기대는 하지말고 볼 것. ,7,3,0,FALSE
2319,17.02.06 2:32,rndu****,그저그러하엿소이다! ,6,3,0,TRUE
2320,17.02.06 1:50,moon****,킬링타임.눈에보이는 후반부. 딱 거까지. ,6,3,0,FALSE
2321,17.02.06 1:14,IMP(c_j_****),윤아랑 유해진 씬 아직도  웃기네요 ㅋㅋㅋ ,8,3,0,TRUE
2322,17.02.06 0:54,러브쩡쩡(phil****),"솔직히, 이 영화를 잼있다고 할수있나요? ",5,3,0,FALSE
2323,17.02.05 22:56,qwe2****,재미있게 받어요 ㅋㅋ  멋지 액션하고 ,5,3,0,TRUE
2324,17.02.05 21:46,다푸웅(hye_****),액션에 5점 만점 5점을 스토리 아쉬웠어요. 영화에 있어 알맹이가 빠진듯한 느낌이었어요.. 정말 잘봣는데 액션보고 감탄 그저 감탄만하고 나왔습니다. ,5,3,0,FALSE
2325,17.02.05 21:01,공초민(anim****),액션과 연기는 합이 맞아서 볼만한데.. 스토리는 흔하면서도 엉성하네.  더킹외에는 경쟁작이 없다는 건 행운이군 ,7,3,0,FALSE
2326,17.02.05 13:09,euna****,B급 영화 스토리에 A급 배우 갖다 써서 기대만 올린 느낌. 일개 동네 형사가 공조 형사로 선발되는 시작부터 지원하나 없는 동네 형사가 국정원도 모르는 일을 혼자 다 처리하는 억지설정으로 시작해서 끝나는 영화 ,3,3,0,FALSE
2327,17.02.05 13:07,타냐(tany****),현빈은 역시 멋있지만 시나리오는...ㅠㅠ 액션도 그렇고 공유가 나왔던 용의자가 훨 낫네요. 평점이 너무 후한듯. 같이본 사람들 반응도 그닥 별로였는데.. 의외로 김주혁의 연기가 인상적이고 돋보였습니다! ,6,3,0,FALSE
2328,17.02.05 12:31,설아설빈맘(sss5****),현빈·유해진 연기 넘 좋아요 ㅋ ,8,3,0,TRUE
2329,17.02.05 12:07,Olivia(sjjm****),멋진 현빈을 또 한번 발견한기회! 가족끼리 주말에 보기  추천~~ ,7,3,0,TRUE
2330,17.02.05 10:34,선화스텐(st45****),잘 받습니다~ 그런데 역시 한국영화네요 ,4,3,0,TRUE
2331,17.02.05 8:53,신동혁(whit****),내가  여자였다면   현빈얼굴 보는맛이라도 있었지...어디서 긴장감이고 손에 땀이냐?  너무심한 알바 아니냐? ,6,3,0,FALSE
2332,17.02.05 4:44,3823****,정말 딱 액션영화다. 생각하게 만드는 영화라기 보다처음부터 끝까지 생각없이 현빈얼굴과 액션 이 두가지만 보다 끝나는 킬링타임용 영화 그 이상도 이하도 아니다. ,7,3,0,FALSE
2333,17.02.05 2:41,jsym****,억지스럽고 뻔한스토리지만 간간히 재미진부분도 있고 가볍게볼수있는영화 ,7,3,0,TRUE
2334,17.02.05 0:41,duyu****,먼가 애매한.. . 흠.. ,6,3,0,TRUE
2335,17.02.05 0:33,박서후(sima****),잼잇다길래 봣는데 그냥그랫음 ,8,3,0,TRUE
2336,17.02.04 23:29,fender짱짱맨(ysys****),기대를 넘 많이 했는지 생각보다 별루네요.넘 웃기고 잼있다고하는데 ~개개인의 취향이니까~ ,7,3,0,TRUE
2337,17.02.04 20:48,daeu****,너무흔한스토리네요  중간중간 생각없이웃을수있어요 ,5,3,0,TRUE
2338,17.02.04 20:15,isy0****,아무생각없이 보는영화 ,4,3,0,TRUE
2339,17.02.04 19:45,미스터우(powe****),주변에서 재미있다고해서 봤는데 개유치한데요.내용도 허술하고 차라리 JSA공동경비구역이나 아저씨가 훨낫네요. 제가 이상한건지 도저히 공감할수 없는데요. ,4,3,0,FALSE
2340,17.02.04 18:54,ㅋㅋㅋ(mls0****),"한없이 B에 가까운 C급영화. 개연성도 없고 어디서 많이 본 듯한 뻔한 스토리 전개, 뻔한 김치식 영화. 돈아까운 영화 ",4,3,0,FALSE
2341,17.02.04 11:14,hi76****,2월4일 보고 왔는데 그냥 그냥 볼만함  난  더킹이 더 재미있음 ,6,3,0,FALSE
2342,17.02.04 11:04,Hk(gudr****),...다소..흠.. 그냥 킬링타임용. 내용부실 억지전개..; ,6,3,0,FALSE
2343,17.02.04 10:36,천살랑(kimh****),현실성은 없고 스토리는 뻔하지만 그냥 생각없이 웃고볼수있는 킬링타임 영화 ,7,3,0,FALSE
2344,17.02.04 9:44,스팀(enha****),유해진과 윤아의 코믹요소가 없었다면 무색무취였을ㅊ것. ,6,3,0,TRUE
2345,17.02.04 8:44,real****,다른분들 리뷰처럼 엄청 재밌다는 느낌은 못받았어요소재도 진부했고 질질끄는거 같아서 살짝 지루하기도 했습니다.현빈은 남자가 봐도 멋있네요 ,7,3,0,FALSE
2346,17.02.04 0:10,All is well(love****),유해진씨 유쾌한 연기랑 현빈씨의 액션이 재밌었음! 다만... 후반부 갈수록 이야기가 허술해지는 느낌... ,7,3,0,FALSE
2347,17.02.03 23:07,봉석(bon3****),내가 본영화중 최악의영화 ,2,3,0,FALSE
2348,17.02.03 22:50,1123(qksg****),액션은 괜찮으나 스토리는... ,6,3,0,FALSE
2349,17.02.03 17:16,우산(kyk2****),배우의 연기는 좋았으나.  스토리의 연결이 미완이라  감명을 받지  못했다. ,7,3,0,TRUE
2350,17.02.03 10:45,이초코(kjbd****),재밌다 오락용영화로 최고 현빈 진짜 멋있다 ,8,3,0,TRUE
2351,17.02.02 23:56,새봄(yaso****),개연성이 조금 떨어지네요 액션은 굿 ,7,3,0,FALSE
2352,17.02.02 23:09,simkihyun(skhc****),스토리는 말같지도 않지만 액션은 볼만함 그리고 이동휘의 연기는 정말 역할에 안어울렸음 ,8,3,0,FALSE
2353,17.02.02 23:00,sami(podo****),아쉽다 모든 게...현빈 액션이 그나마 살림 ,4,3,0,FALSE
2354,17.02.02 22:56,유(dbfl****),현빈멋있었다 딱 그뿐... ,4,3,0,FALSE
2355,17.02.02 22:19,정진희(jinh****),액션과 현빈얼굴빼고는 볼게 없더군요 ㅎㅎ ,2,3,0,FALSE
2356,17.02.02 21:07,하이(whdd****),평점 7점대정도 인듯. 스토리도 액션도 연기도 어설퍼 ,6,3,0,FALSE
2357,17.02.02 18:59,ㅇㄴㄻㄹㄴ(wooj****),한국 영화 특징 총집합된 졸작 ,3,3,0,FALSE
2358,17.02.02 18:39,쇼미더상평통보(byg5****),현빈잘생겼다. 근데 결말이좀 ,8,3,0,TRUE
2359,17.02.02 18:21,ashn****,마무리가허접했습니다.... ,7,3,0,TRUE
2360,17.02.02 16:49,킹왕짱(t1cc****),유해진은 언제나 연기잘함~현빈의 액션가능성~김주혁의 새로운 악역도전...  하지만  짜임새없고 어설픈 스토리ㅜㅠ ,6,3,0,FALSE
2361,17.02.02 16:24,Suvkm13(suvk****),정말 노잼... bgm도 너무 촌스럽고 갑자기 튀어나와서 집중안되고 현빈 얼굴 잘생기고 멋있는거에만 집중한 영화같음.... 유해진 연기를 이런데다 쓰면 되나정말...ㅠ 기대많이 했는데 실망만 남겼다... 왜 재밌다는지 1도 모르겠다.. ,3,3,0,FALSE
2362,17.02.02 16:14,사랑합니다잉(jeew****),그냥 한번 보기 적합한 CJ 감성 액션 영화 ,6,3,0,FALSE
2364,17.02.02 15:58,스트레스파이터(1775****),내용구성이 조금 아쉬었음 ,5,3,0,TRUE
2365,17.02.02 12:36,여니빠(lees****),추천합니다 재밌어요 ㅋㅋ ,9,3,0,TRUE
2366,17.02.02 11:36,머링(cyic****),이 영화에서 윤아가 진정 '짧고 굵다'는 의미가 뭔지 일깨워줬지... ,8,3,0,FALSE
2367,17.02.02 11:34,cjft****,너무너무 재밌어요 !강추 ,8,3,0,TRUE
2368,17.02.02 11:03,파스카(kdws****),잼게봤어용 다만 후반 액션씬이 뭔가 어색.. ,8,3,0,TRUE
2369,17.02.02 9:37,어절쒸구뤼(mong****),오랜만에 현빈 잘봤네요. 뱅들의조합도 괜찮았습니다. ,8,3,0,TRUE
2370,17.02.02 9:28,파란발스머프(calo****),현빈 유해진 김주혁 모두 멋있었어요 ,8,3,0,TRUE
2371,17.02.02 9:04,다다닥(tedd****),가볍게 보기에 재미있었습니다~ 예매율 1위까지할만한 지는 잘모르겠고 그냥 쏘쏘였습니다 ,6,3,0,TRUE
2372,17.02.01 23:07,heah****,배우가다한영화ㅋㅋㅋ 킬링타임으로 딱! 현빈은 멋있고 유해진은 찰지게 재밌었어요! ,7,3,0,TRUE
2373,17.02.01 22:19,김현욱(kjg4****),재밋지만 현빈원톱인영화....아쉽네요내용도 깔끔하게 안흘러가는거같고.. ,8,3,0,TRUE
2374,17.02.01 22:16,딸기맛담배(jjre****),개인기록용현빈 유해진 김주혁 멋지게 나왔고 코믹요소도 조금씩 있었고 자기캐릭터 잘살렸지만영화 내용은 뻔하고 액션은 아직 한국영화수준을 보여준다..2시간이 금방갔지만 뭔가 허전한느낌... ,7,3,0,TRUE
2375,17.02.01 20:26,겨누찌(limk****),현빈의 액션씬 말고는 별로.. ,7,3,0,TRUE
2376,17.02.01 11:17,이경원(dbfl****),더킹보단 별로..결국 그런스토리 옜날공유가북한형사할때가 더멋있음 ,8,3,0,FALSE
2377,17.02.01 7:30,짱가짱가(kamu****),주인공 현빈과 유혜진의 탁월한 연기력은 인정..다만 스토리의 전개과정이 아쉬움 ,7,3,0,FALSE
2378,17.02.01 0:41,Rio(nano****),현빈과 유해진이 전부인 킬링 타임용 영화 ,7,3,0,FALSE
2379,17.01.31 21:35,소왕대래(popo****),스토리와 전개도 모도 좋았다. 유해진의 연기가 오랫만에 자연스러웠다. 액션도 좋았지만 마지막은 약간 생각할 것도 남겨진 영화였다. 빨리 통일이 되었으면... ,8,3,0,TRUE
2380,17.01.31 21:25,guni****,내용이 그런데로 볼만한 영화네^^ ,8,3,0,TRUE
2381,17.01.31 21:14,jins****,현빈액션은 살아있음~ ,8,3,0,FALSE
2382,17.01.31 21:07,lee1****,재미있고  유해진  넘 웃겨..역쉬 ,10,3,0,TRUE
2383,17.01.31 20:58,gray(gray****),현빈 너무 멋있어ㅠㅠㅠㅠ액션씬 쩌러 ,8,3,0,FALSE
2384,17.01.31 20:56,tjdg****,킬링타임용 영화로 좋은것 같습니다 ,8,3,0,TRUE
2385,17.01.31 20:48,강지은(jieu****),현빈이 오랜만에 볼만한 영화를 찍었네. ,7,3,0,TRUE
2386,17.01.31 20:41,초롱(shin****),현빈의 액션연기 넘나 멋집니다!! ,8,3,0,TRUE
2387,17.01.31 20:41,연화(kzxc****),빙구형 현빈 유해진 머시따 ,8,3,0,TRUE
2388,17.01.31 20:29,민아(hado****),짜임새 탄탄한 내용이네요끝까지 긴장되게 잘봤어요현빈 넘 멋있어 ㅋ ,8,3,0,TRUE
2389,17.01.31 20:27,immG3(4858****),재미있게 본 영화 ㅋㅋㅋ 아빠와 함께 설 마무리한 영화 ㅋㅋ 스토리로 따지면 더킹. 공조는 엄청 진지한데 ㅋㅋㅋ중간중간 계속 웃김 ,8,3,0,TRUE
2390,17.01.31 20:23,감(rlac****),나름 볼만했다ㅋㅋㅋ 비하인드도 훈훈하고 좋았음 ,8,3,0,TRUE
2391,17.01.31 19:58,은혜의 강물(bsy3****),가상의 시나리오지만 남과북을 이해하며 공감 할 수 있는 내용과 스릴과 액션 그리고 반전이 있어 지루하지 않고 끝까지 재미있게 볼 수 있어 좋았다~^^ ,8,3,0,TRUE
2392,17.01.31 19:57,농군(farm****),헌빈의 추격씬  남과북의 멋진 의리 ,8,3,0,TRUE
2393,17.01.31 19:56,mrws****,"생각보다 재미있게 봤습니다. 총맞고 높은 곳에서 떨어진 김주혁이 멀쩡하게 회복해서, 부하까지 모아서 나타나는 장면이나, 기타 등등 아쉬운면이 없지 않아 있었지만, 상당히 유쾌하게 봤어요.^^ ",7,3,0,TRUE
2394,17.01.31 19:04,쾌룡(bjb7****),"재미 있게 봤어요,더 재밌는거 없어요? ",8,3,0,TRUE
2395,17.01.31 19:03,바보(brai****),흥미로운 아이디어와 배우들의 멋진연기  짱입니다 ,8,3,0,TRUE
2396,17.01.31 19:02,허술함의극치(artg****),가족영화로 보기 좋아요 ,8,3,0,TRUE
2397,17.01.31 17:07,oruko(xoru****),평점이 좋아서 기대를 너무 많이해서 그런건지 딱 덜도 말고 더도말고 킬링타임용이었습니다 ,6,3,0,TRUE
2398,17.01.31 15:18,낭창이(clou****),"여기평점들이 너무높아서 당황;;현빈 액션빼곤 딱히 볼게없었습니다. 내용도 좀 부족했고, 아쉬웠던 영화. ",5,3,0,FALSE
2399,17.01.31 14:46,메리제인(lcs1****),요즘 티비드라마도 이정도는 한다. ,5,3,0,FALSE
2400,17.01.31 8:59,유림(ees7****),재밌게봤어요   가족영화로  좋아요유해진표  코믹영화  네요 ,8,3,0,TRUE
2401,17.01.31 8:56,r1t2****,기대이상으로 재밌었어요?? 현빈 짱 멋있음 ,8,3,0,TRUE
2402,17.01.31 3:34,루미(minj****),설날명절 예매 순위1위라서 공조 봤는데재밌게 봤어요역시 유해진씨 나오는건대체로 다 재미있는거같아요코믹한 요소도 간간히 있어서지루하지 않고 영화도 너무무겁지 않았어요또 현빈씨도 너무 멋있었어요킬링타임용으로 추천합니다 ,8,3,0,TRUE
2403,17.01.31 2:18,ssil****,잘생긴 배우의 볼만한 액션..그뿐.. 내용은 진짜 비슷한 영화가 몇개가 떠오를 정도로 식상ㅜ ,7,3,0,FALSE
2404,17.01.31 2:08,안은경(kwki****),한국영화의 전형적인 흐름 ,5,3,0,FALSE
2405,17.01.31 1:26,msja****,스토리가 연결이 빈약함 ,7,3,0,TRUE
2406,17.01.31 0:32,lhj6****,이게 재밌다는 사람들 보면 불쌍함. 우리나라만의 주입식 교육 때문인듯 ,4,3,0,FALSE
2407,17.01.30 23:54,ve(buri****),생각했던거보단  별로... 하지만  현빈의 액션씬은 멋있었네요 ,7,3,0,FALSE
2408,17.01.30 23:22,jand****,[의형제]의 완벽한 하위호환. 올해만 지나면 다시 언급될 일 없을 영화. ,4,3,0,FALSE
2409,17.01.30 23:03,ohlg****,너무 기대를 많이 했나.. 개인적으론 별로였네요. ,6,3,0,FALSE
2410,17.01.30 21:22,이수민(lsms****),현빈 보러 가는 영화ㅎㅎ ,8,3,0,TRUE
2411,17.01.30 20:12,새마을짱(5027****),공조 ..현빈의 액션연기 멋있었어요.총격전은 더더욱 스릴있었네요 ,8,3,0,TRUE
2412,17.01.30 19:49,only****,엄마와함께 즐겁게 봤다  둘의 케미가 의외로 괜찮네 ㅋㅋ ,8,3,0,TRUE
2413,17.01.30 18:03,핑구(spin****),씨제이 영화같다했더니 역시나 씨제이 ㅎㅎ 뻔한 것 좀 그만 좀 해여..지겨워여..유해진씨연기 옆집아저씨같고 좋았어요. 현빈씨 액션 멋있네요. 근데 머 터지는 씬은 저예산영화같았어요. 그냥 가족끼리 설날 보기 좋은 영화. 조연들 보는 재미도 있었어요. ,5,3,0,FALSE
2414,17.01.30 17:56,ekdm****,재밌습니다 중간에 조금 지루함 ,7,3,0,TRUE
2415,17.01.30 15:57,유이(um85****),공조 중반부까지 보면서 드는 생각..아이씨 더킹 볼걸..진짜 스토리가 엉망진창임 유해진 김주혁 연기잘한다..현빈 멋있다..이게 다임 ,3,3,0,FALSE
2416,17.01.30 15:24,486s****,현빈만 보인단말이야~~~~ ,8,3,0,TRUE
2417,17.01.30 13:41,Luv_hoya(heeu****),"브로맨스 케미, 감동, 웃음코드, 어느것 하나 건질게 없네더킹이랑 비교가 되나? 평론가 평점보면 답 나오지! ",3,3,0,FALSE
2419,17.01.30 12:28,hans****,뻔한 전개.... 아무 생각 없이 보면 시간떼우기용으로 볼 만 하다.. 유해진 코믹연기와 현빈의 액션으로 먹고 살 것 같은 영화.. ,6,3,0,FALSE
2420,17.01.30 11:56,레몬토닉(23rk****),"더킹은 시국을 노렸고, 공조는 설 특수를 노렸다. ",7,3,0,FALSE
2421,17.01.30 11:53,kk_h****,근래 본 최악의 한국영화 ,3,3,0,FALSE
2422,17.01.30 11:42,serendipity(ds45****),저는 노잼 자다 나왔는데 만원아까워요. ,3,3,0,FALSE
2423,17.01.30 11:41,Stanley(seba****),킬링 타임용 버디무비. ,6,3,0,FALSE
2424,17.01.30 7:06,gaby****,배우가 중심에 있는 영화. 두 주인공과 김주혁의 연기 감상만으로도 충분히 즐길 수 있었음. ,8,3,0,TRUE
2425,17.01.30 4:54,바다전설(skyl****),유쾌하고 재미있었음. ,7,3,0,FALSE
2426,17.01.30 4:52,dlad****,볼만하고 재밌네요... ,8,3,0,TRUE
2427,17.01.30 3:54,호구왕(dydi****),스토리부진 재미는 있음 ,8,3,0,TRUE
2428,17.01.30 3:27,zzzz****,잼나네 내 주관적임 주위에서도 재밌었다는평이 ,7,3,0,TRUE
2429,17.01.30 2:50,miss****,뭔가 예상되는 줄거리...깜짝 놀란 반전이 있거나 그런건  아니였던 것 같아요... 전 현빈 보는 즐거움으로 보았으나 남자친구는 영 재미없다고 평을 주던 영화였습니다! ,7,3,0,TRUE
2430,17.01.30 2:45,째라시다(cats****),웃음과감동이있는영화였네요 ,8,3,0,TRUE
2431,17.01.30 2:18,park****,생각지도 못한 주제로 코믹을 살짝 섞은 점이 심심치 않은 재미가 있어 좋았음 ,7,3,0,TRUE
2432,17.01.30 1:48,페이토(peki****),가족끼리 그냥볼만하네요 ,7,3,0,TRUE
2433,17.01.30 1:46,뚜양(gisl****),신박한 내용은 아니지만 현빈 멋지고 유해진 연기 때문에 나뿌지 않은 ! ,8,3,0,TRUE
2434,17.01.30 1:37,sjfj****,중간중간잼있었습니다 ,8,3,0,TRUE
2435,17.01.30 1:08,EunJae(euns****),중간중간 웃긴장면 재밌었어요 ㅋㅋ 현빈 존멋.. ,8,3,0,TRUE
2436,17.01.30 0:57,너여야만해(piki****),설연휴를 위해 만든 남북 공조 ㅡ 웃고 즐길 수 있는 영화 볼만 합니다. 현빈씨 유해진씨 수고 하셨어욤 ㅎㅎ ,8,3,0,FALSE
2437,17.01.29 23:18,자화룡(tmdq****),그냥저냥 볼만한데 영화는 영화일뿐  멸공북진! ,8,3,0,TRUE
2438,17.01.29 22:54,임수경(anft****),만추 땬 현빈 연기가 별로였는데... 오늘은 그래도 잘 보고 왔슴다. ,6,3,0,TRUE
2439,17.01.29 22:53,행복(alsw****),유해진 덕에 많이 웃다왔다 ,7,3,0,FALSE
2440,17.01.29 22:53,혜빈혜성맘(pkh4****),뻔한 내용이라는 게 아쉬웠지만 시간가는 줄 모르고 봤네요~  배우들 연기력 최고^^ ,8,3,0,TRUE
2441,17.01.29 21:55,정호(er00****),평범한 그냥 명절때 특선영화로보면 될것같은  영화 ,7,3,0,TRUE
2442,17.01.29 21:14,꼴닭(smal****),잼있긴 보긴 했는데 중 후반 부터 너무 뻔한 전개가 아쉬움 ,7,3,0,FALSE
2443,17.01.29 21:05,wlgm****,연기자들의 연기와 액션은 더할 나위 없이 좋았지만 너무 뻔한 스토리..갈수록 전형적인 한국영화 ㅋㅋㅋㅋ 뭐 그래도 시간 가는 줄 모르고 재밌게 봤음 킬링타임용으로 괜찮은 듯 ,8,3,0,FALSE
2444,17.01.29 20:05,qjad****,넘재미나네요. 유해진에 맛깔스러운  말투와 현빈에 잘생긴얼굴. 김주혁에 카리스마  너무들 다 멋지십니다 ,8,3,0,TRUE
