,time,ID,text,score,like,dislike,watch_movie
4981,17.01.23 12:08,sesmyj(lils****),현빈 존멋!!!남친이랑봤는데 계속 깔깔되면서 웃으면서 봤어요!! 김주혁과 유해진 연기도 진짜 좋았어요 ><강추강추!!!! ,10,3,1,FALSE
4982,17.01.23 12:08,김지영(gkdl****),공조 말이 필요없음 고민하고있다면 꼭꼭꼭 봐야되는 영화개잼 꿀잼ㅋㅋㅋㅋ? ,10,3,1,TRUE
4983,17.01.23 12:08,박광인(gold****),정말재밋엇습니다 ㅎㅎ ,9,3,1,TRUE
4984,17.01.23 12:06,서용준(jonc****),살짝 아쉬운감이 있기는 하지만 재밌게 잘 봤습니다. ,10,3,1,TRUE
4985,17.01.23 12:04,양잉양(hero****),영화관에서 오랜만에봣는데지루하단느낌도없엇고 잘봣습니당!!! 재밋어영 ,9,3,1,FALSE
4986,17.01.23 12:00,sg6702(seun****),이 영화 말이 필요없는 영화 아침부터 재밌네요. ,10,3,1,FALSE
4987,17.01.23 11:46,소리나무(wjd8****),잼나게봤음 ~현빈유해진 꿀조합 ,8,3,1,FALSE
4988,17.01.23 11:44,mw21****,김주혁 연기 너무 잘함! ,10,3,1,TRUE
4989,17.01.23 11:25,요맨(sooo****),진짜 내용도 너무재밌고 영화도진짜 잘만들었고 역시 유해진 은 너무재밌다 ㅋㅋㅋ ,10,3,1,FALSE
4990,17.01.23 11:24,kimk****,알고있었지만 새삼스레 다시 느꼈다 현빈 완전 멋지다  +.+ ,10,3,1,FALSE
4991,17.01.23 11:20,임현남(ihm0****),액션넘멋지구잘하셨구~코믹작품입니다~악역최고구요다수인물들절대무시할수없었던영화 ,10,3,1,FALSE
4992,17.01.23 11:02,onion(me__****),액션에 놀라고 케미에 빵터짐 재밌네 ,10,3,1,FALSE
4994,17.01.23 10:59,고은(lke1****),기대하지않앗는데 넘나 재밌게봤다!!! 역시 유해진 짱!!! ,9,3,1,TRUE
4995,17.01.23 10:43,동연이(cdy2****),대박!!! 완전 재밌었습니다. 계속 흥행하시길~!! ,10,3,1,FALSE
4996,17.01.23 10:18,펠르시안친칠라(seoc****),현빈씨 너무 잘생겼어요 유해진씨도 너무 재밌고요...솔직히 더킹보다 재밌음 ,10,3,1,FALSE
4997,17.01.23 10:17,으하하하(alsw****),유쾌하고 재밌고 액션도 좋았음 ,10,3,1,TRUE
4998,17.01.23 10:15,이지윤(jjii****),울 가족 친구 언니들과 본 공조 정말 재미있어요 현빈액션짱 유해진입담과 엉뚱한 매력녀 윤아 새해엔 #공조 대박나길 천만가자 ,10,3,1,FALSE
4999,17.01.23 10:13,박소현(eksl****),말이 필요없슴 빨리가서보세  존 잼 첨부터 끝까지 지루함 단 1분도 없음 팝콘 다남기고옴 몰입도 쩔탱 ,10,3,1,FALSE
5000,17.01.23 10:06,love(08le****),현빈의액션 유해진의코믹 기대이상이예요  윤아 진짜 귀여워요 현빈이랑 윤아 캐미도 굿굿 ,9,3,1,FALSE
5001,17.01.23 10:01,ykr9****,너무재미있게본영화다 ,9,3,1,TRUE
5003,17.01.23 0:35,ej(pure****),처음부터끝까지 흥미진진 재밌었다 ,8,3,1,TRUE
5004,17.01.23 0:29,djag****,유해진은 역시 말할 필요없고현빈은 액션으로는 처음봤는데 정말멋있었어요보길잘한거같아여ㅋㅋ ,8,3,1,TRUE
5005,17.01.22 23:03,신성또렛(jnkw****),너무 재밌게 잘 봤습니다. 액션도 괜찮아요! ,10,3,1,TRUE
5006,17.01.22 22:52,불타는감자(dlrl****),평식이형도 이건 잘 주지않을까.. ,10,3,1,TRUE
5007,17.01.22 22:51,캡틴헨더슨(ymg0****),유쾌하고 통쾌하고~ 재밌었따 ,9,3,1,TRUE
5008,17.01.22 22:48,YANG(fghs****),믿고보는유해진!!! ,10,3,1,TRUE
5009,17.01.22 22:47,예원사랑(hyn0****),현빈의 멋스러움에 새삼 즐거운 눈요기였어요~ ,9,3,1,TRUE
5010,17.01.22 22:46,시냉(dltl****),생각보다더재밌엇어요 ,10,3,1,TRUE
5011,17.01.22 22:38,kso5****,"현빈,유해진코믹하먼서가슴뭉클.멋져요. ",9,3,1,TRUE
5012,17.01.22 22:35,dhth****,"현빈,유해진 케미짱짱이였구 진짜너무잼있어요ㅠㅠ두번보고세번보세요!!! ",10,3,1,TRUE
5013,17.01.22 22:33,dlcj****,"그냥 현빈을위한영화, 그리고 뻔한내용 ",6,3,1,TRUE
5014,17.01.22 22:29,zxsk****,시간가는줄 모르고 재밌게 봤다 ^-^ ,10,3,1,TRUE
5015,17.01.22 22:28,love****,와우넘잼남 현빈 캡 멋짐 ,10,3,1,TRUE
5016,17.01.22 22:28,뜬구름(sumi****),1.01E+33,9,3,1,TRUE
5017,17.01.22 22:23,한비야(shdm****),재미있어요~현빈 김주혁 유해진 정말정말 멋져요^^ ,9,3,1,TRUE
5018,17.01.22 22:07,1995****,재밌었어용~~ 현빈 너무 멋있었고 유해진도 웃기고 멋있었어요ㅋㅋㅋ ,9,3,1,TRUE
5019,17.01.22 22:01,미떼(twin****),현빈 겁나 멋있어요.... ,10,3,1,TRUE
5020,17.01.22 21:57,sszz****,공조>더킹 팩트 김주혁 연기 소름 ,10,3,1,FALSE
5021,17.01.22 21:54,gns6****,연기들을 너무잘해서 스릴있고  재미난영화~ ,10,3,1,TRUE
5022,17.01.22 21:53,소빵이(thgu****),"진짜 졸잼!! 지루하지않고 시간,돈 모두 안 아까움 ",10,3,1,TRUE
5023,17.01.22 21:48,dlst****,재밋네요ㅎㅎ ㅎㅎ10자 ,9,3,1,TRUE
5024,17.01.22 20:21,캬캬캬캬(wngm****),현빈에게ㅔ 반하고 갑미당 >< ,10,3,1,TRUE
5025,17.01.22 19:17,뿌이잉(non3****),갓현빈 갓해진ㅠㅠㅠ 재밌게봤습니다 ,10,3,1,TRUE
5026,17.01.22 18:25,레드아롱 김상목(k368****),최근에본영화중최고입니다평론가들이별2개줬다는데..소재가특별하지않아서그런가봐요저는정말재밌게봤습니딘 ,10,3,1,TRUE
5027,17.01.22 18:23,jhp4****,기대안했는데 생각보다 너무 재밌게봤어요. 배우들의 연기력이 역시 짱이네용~ ㅎㅎ ,10,3,1,TRUE
5029,17.01.22 18:03,RKRRnd(mymy****),연기력도 좋고 둘의 케미가 좋네요 ,9,3,1,TRUE
5030,17.01.22 18:03,냠(olml****),현빈 연기를 잘할줄은 몰랐음 유해진하고 현빈 덕에 영화 재밋게 본듯 ,10,3,1,FALSE
5031,17.01.22 17:06,jwm1****,연기력들이 다들 좋음 유해진 현빈 윤아 다 굿 ,10,3,1,TRUE
5032,17.01.22 17:02,양민아(goal****),"내 여친 현빈한테 빠져버림 ㅡ.,ㅡ 나도 형사되고싶다... ",10,3,1,TRUE
5033,17.01.22 17:01,히야(smj7****),정말 재밌었다. 현빈은 정말 잘생겼고 주연 모두 다 연기를 잘했다. ,10,3,1,FALSE
5034,17.01.22 16:45,최지은(cje0****),"엄마 모시고 같이 봤는데 처음부터 끝까지 몰입해서 봤네요^^ 재미있게 잘 봤어요~ 배우분들 모두 캐릭터 소화 잘하셨고, 개봉 전 이슈가 되었던 주연 분들 외에도 김주혁 분의 악역이지만ㅠ 카리스마 있는 연기 보고 인상에 많이 남았네요^^ 멋있었어요! ",10,3,1,TRUE
5035,17.01.22 16:09,soyoung park(psy7****),완전 재미있음. 씨즌2가 나오면 좋겠음 ,9,3,1,TRUE
5036,17.01.22 15:49,프리덤(dear****),"현빈의 액션 정말 짱, 얼굴은 짱짱짱~~ 시나리오가 아쉽 ",7,3,1,FALSE
5037,17.01.22 15:46,ss22****,"유해진 현빈의 연기합이나 조화도 물론 좋았지만, 난 김주혁의 눈빛이 잊혀지지가 않는다. 어쩌면 코믹과 액션의 애매한 경계를 탈 뻔한 이 영화가 그래도 액션이다!라고 자신있게 얘기할 수 있는건 김주혁때문임 ",8,3,1,FALSE
5038,17.01.22 15:23,Bonobono(juli****),재미는 있지만 연출이 아쉽다. ,7,3,1,FALSE
5039,17.01.22 15:06,정환희(daun****),현빈의 액션이 끝내줍니다^^ ,9,3,1,TRUE
5040,17.01.22 15:01,deat****,나름 볼만했구 괜찮았음 ,10,3,1,TRUE
5041,17.01.22 14:47,towa****,현빈 너무 멋있고 그저그런 시시한 액션이 아니라 급이 남달랐다 ,10,3,1,TRUE
5042,17.01.22 14:46,히융(lje8****),진짜 심각할 정도로 재밌어요!!! ,10,3,1,FALSE
5043,17.01.22 14:44,맛있음(sesv****),역시는 역시 믿고보는 헝아들 ,10,3,1,TRUE
5044,17.01.22 14:41,구리뽕(soul****), 재밌어요  굿!   잘생김과 즐거움이 함께하네요ㅋㅋ ,9,3,1,FALSE
5045,17.01.22 14:30,Heo Dong Wook(kjr0****),와 이때까지 본영화중에5손가락안 ,10,3,1,FALSE
5046,17.01.22 14:21,Heaven(8353****),재밌습니다!역시 유해진! ,9,3,1,TRUE
5047,17.01.22 14:16,김진희(nino****),복잡한 현실에 마음껏 웃으면서 볼수 있는영화 ,10,3,1,FALSE
5048,17.01.22 14:16,쫑이cy(rkdn****),강추입니다 스토리도 짱짱하네요^^! ,10,3,1,TRUE
5049,17.01.22 14:14,khys****,더킹보다 재밋게 봣습니다 ^^ ,10,3,1,FALSE
5050,17.01.22 14:01,불꽃남(axll****),헐리우드급 액션으로 인정요! ,9,3,1,FALSE
5051,17.01.22 14:00,융융(from****),"믿고보는 유해진님! 더불어, 깨알 코미디장면들과 현빈 유해진님의 액션도 좋았구요~ 감기에 나온 아역배우도 오랜만에 보니 굿 ",9,3,1,FALSE
5052,17.01.22 13:21,rkda****,굉장히 흥미진진했고 유해진의 유쾌한 연기가 웃음을짓게 해줬던 영화네요 ,8,3,1,TRUE
5053,17.01.22 13:18,형준맘(milk****),굉장히 재미있음....잘 보고 왔어요... ,10,3,1,FALSE
5054,17.01.22 13:16,쌜리승짱(sall****),"유해진씨 보고 보기로 결정했는데 이 영화보고 현빈씨를 다시 봤네요.유해진씨 연기야 뭐 말할필요 없으시고 ,둘의 케미도 넘 좋고 액션씬들도 박진감 넘치고 유쾌하게!재밌네요!많이 웃었어요. ",10,3,1,FALSE
5055,17.01.22 13:11,lkm7****,재밌고 알찬 내용이었어요~ 정말 현빈 멋지네요~ ,10,3,1,TRUE
5056,17.01.22 12:56,인금환(yk98****),가족과함께보면 더 좋을듯 하네요남자가봐도 현빈 멋있어요 ,10,3,1,TRUE
5057,17.01.22 12:39,예은(aass****),정말 내가 최근 몇년간 본 영화 중에 제일 멋있고 현빈의 카리스마와 유해진의 개그와 김주혁의 악역연기가 어우러져 정말 재밌는 영화다 진짜 추천 해요 ,10,3,1,FALSE
5058,17.01.22 12:39,_(sexy****),조조로 봤는데 재밌어요 현빈 진짜 멋있음...♡ 그와중에 김주혁 연기 너무 잘해ㅠㅠ ,10,3,1,FALSE
5059,17.01.22 12:30,천하무적(euns****),유해진 현빈 케미  넘 좋구 현빈 액션연기 쩔었음 ,10,3,1,TRUE
5060,17.01.22 12:30,lhjl****,가족들과 웃으면서 볼수 있는영화예요.현빈과 유해진  멋지고 재밌어요. ,9,3,1,TRUE
5061,17.01.22 12:11,빽지(zoqw****),올 한해 스크린을 공조한다 ,7,3,1,TRUE
5062,17.01.22 12:07,아들딸맘(wltn****),지루하지않고  웃기고  멋지고 잼났어요...요즘  너무  정치적영화가 많아서  보고나면..  좀그런데..이건  보고나서  와그냥  잼나네...  현빈멋찜멋찜 ,10,3,1,FALSE
5063,17.01.22 11:20,억지(dldl****),완전 깨알재미 있었음ㅋㅋ ,10,3,1,TRUE
5064,17.01.22 11:09,리미(cw21****),존잼~~~!!!!12344 ,10,3,1,TRUE
5065,17.01.22 11:05,gusw****,현빈잘생겼고 잘생겼음 ,10,3,1,TRUE
5066,17.01.22 10:56,brav****,재밌어요! 액션신도 굿! ,10,3,1,TRUE
5067,17.01.22 10:35,153153zz(gnlr****),현빈은무적이다!!! ,10,3,1,TRUE
5068,17.01.22 10:27,foof****,현빈 발차기 각이 멋짐. 현빈의 액션이 다살린 영화네요 ,9,3,1,TRUE
5069,17.01.22 10:27,708s****,현빈과 유해진의 조화가 영화의 재미를 더해주었다 ,9,3,1,TRUE
5070,17.01.22 10:04,박사장(okbk****),공조가 왜 예매율2위인지 이해가 안간다지금상영작중에 가장 재밌음 강추합니다 ,9,3,1,FALSE
5071,17.01.22 8:26,지혜(jhsh****),진심 연기도 잘하고 재밌음 ,9,3,1,TRUE
5072,17.01.22 5:42,나의인생(ccha****),기대 없이 봤는데 볼 만함... 현빈 액선 생각보다 잘해서 깜놀. ,7,3,1,FALSE
5073,17.01.22 3:47,too5****,현빈과유해진의캐미가환상적이네요~얼핏어울리지않아보일수도있는데오히려그게반전의매력인것같습니다.그리고영화속김주혁도비록나쁜역할이었지만매력이철철넘쳤습니다.전반적으로개개인의캐릭터가잘산영화라아주만족합니다 ,9,3,1,FALSE
5074,17.01.22 2:56,네이마르(minh****),여러분 꼭보세요 대박이에요근데 단점이 저처럼 현빈한테 빠져서 일상생활이 불가능 해질수도 있습니다.. ,10,3,1,FALSE
5075,17.01.22 2:56,willowT(will****),스토리가 예상되지만 그래도 재밌는 영화였습니다. 초반에 조금 부진하다 느낄때쯤 부터 쭉 재밌어요. 역시 현빈이고 역시 유해진입니다. ,10,3,1,FALSE
5076,17.01.22 1:03,우유팩(mvmi****),"내용이 부실하지만 액션이 좋음.. 두 주인공이 너무 쉽게 빨리 친해진 것 같음. 액션이 진하지만 짧은 것 같기도 하고... 하지만 결말 괜찮았고, 시즌2 나왔으면 좋겠다는 생각이 듦. 그리고 현빈 정말 잘생김. ",8,3,1,FALSE
5077,17.01.22 0:45,보통여자(azur****),끝까지 재밌게 봤어요 현빈은 멋지고 유해진은 웃기다한국액션 발전 많이 한듯~ ,10,3,1,FALSE
5078,17.01.22 0:14,김장호(kj28****),말로 표현할수없는즐거움~~한순간도 놓치고싶지않았던긴장감~ 현빈&유해진 넘 멋져요 ,10,3,1,TRUE
5079,17.01.22 0:09,홍선표(onit****),영화 재밌네요 유해진 현빈도 연기좋고윤아도 이쁘네요 ㅎㅎㅎㅎ잘 봤습니다 !! ,10,3,1,TRUE
5080,17.01.22 0:08,dlal****,아..현빈 슈트빨 지리구요 ㅠㅠ액션신 대박이엿어요 정우성조인성 나오는거 볼까하다 유해진믿고 이거봣는데 역시 실망시키지않는다는 ㅋㅋ 진짜 중간중간 빵터졋네요 ㅋㅋㅋ ,10,3,1,TRUE
5081,17.01.22 0:08,빈하트(lks0****),부모님이랑 보시는거 강추 내용이 꿀잼이면서 감동적인 그런영화 ,10,3,1,FALSE
5082,17.01.21 23:18,김명옥(adi2****),꿀잼 땀까지 날정도로 흥미진진하고 재밌었음 ,10,3,1,FALSE
5083,17.01.21 23:12,연비양(hera****),진짜 액션과 코믹이 적절히 섞여서 너무 재밌었어요!!!2시간이 그냥훅감ㅋ ,10,3,1,FALSE
5084,17.01.21 23:02,cosm****,솔찍히 더킹보다 잼나욧~ ,8,3,1,TRUE
5085,17.01.21 22:53,Claire(park****),현빈 무대인사 때 봤는데 완전 잘생김 ㅋㅋ 오늘부터 현빈 팬 됐다는 ㅋㅋ 영화에서도 진심 멋있음 ㅋㅋ ,10,3,1,FALSE
5086,17.01.21 22:52,김다송(rlae****),김주혁이라는 배우를 새로 볼 수 있었고 믿고보는 유해진의 연기 그리고 현빈의 멋짐을 느낄 수 있었다 ,10,3,1,FALSE
5087,17.01.21 22:42,와니맘(eunj****),잔인한 장면이 없어서 좋았고..간간히 웃을수 있고 편하게 오기 좋네요 ,10,3,1,TRUE
5088,17.01.21 22:41,le05****,넘 재미나고 코믹한게 굿입니다 ,9,3,1,TRUE
5089,17.01.21 22:25,몽키둥이(youl****),"너의 이름은 보고싶었는데 같이 간 사람이 본거라며 공조를 예약해서 사실 자고 와야지.. 하며 봤는데 웬걸;;액션씬 대박이고 유해진씨 겁나 재미있구, 김주혁, 현빈씨 짱 멋있구..ㅠㅠ 재밌게 보고 왔어요 정말♥ ",10,3,1,FALSE
5090,17.01.21 22:24,또에나(star****),기대 않고 봤는데 스릴 액션 코믹 골고루 다있고 무엇보다 지루하지 않았던 영화였음 ,10,3,1,FALSE
5091,17.01.21 22:22,주정옥(wnwj****),기대이상 재미있었어요!! ,9,3,1,TRUE
5092,17.01.21 22:18,a1241(dkfm****),공조ㆍ너무재밌네요ㆍ현빈멋지고 액션연기 너무좋고 유해진‥케미도 좋고 윤아씨  연기에 놀랬구 참예쁘네요 ,10,3,1,TRUE
5093,17.01.21 22:09,행복이(lois****),"재밌네요....더킹과 공조중 뭘 볼까 고민하다 공조가 빠른 시간이라 봤는데, 잘했다고 스스로를 칭찬했습니다.ㅋ 믿고 보는 유해진에 현빈이 멋있다고 생각한 게 처음이네요ㅎㅎ 액션이 시원시원합니다. 또 보고 싶네요~ㅋ ",10,3,1,FALSE
5094,17.01.21 21:23,똔똔(clar****),너무너무재미있어요 강추합니당 ,10,3,1,TRUE
5095,17.01.21 21:19,비밀(mbf8****),너무재미있어용!!! ,10,3,1,TRUE
5096,17.01.21 20:16,정우(jm75****),현빈 남자가 봐도 너무 멋져요. 유해진도 ㅋㅋㅋ현빈이랑 유해진이 이렇게 잘맞는지 몰랐네요. ,10,3,1,FALSE
5097,17.01.21 20:16,윤영내(0320****),유해진과 현빈의 브로맨스가 최고 스토리도 지루하지않고 재밌습니당 ,9,3,1,TRUE
5098,17.01.21 20:15,jay80(pjy0****),오늘 보고왔는데...지루하지않고 재밌게봤어요오랜만에 재밌게본 영화 ,9,3,1,FALSE
5099,17.01.21 20:15,진짠모두가알아보는법(pooh****),진짜 너무 재미 있어서 졸린것도 잊고 봤네요. 진짜 추천드려요. ,10,3,1,FALSE
5100,17.01.21 20:14,남정희(jung****),재미 있어요현빈 액션도 잘하더라고요 ,9,3,1,TRUE
5101,17.01.21 20:12,cjcw****,대박 꾸르잼~~!!! ,10,3,1,TRUE
5102,17.01.21 20:10,Lee(ljyb****),재밌어요 액션신 최고!! ,9,3,1,TRUE
5103,17.01.21 20:08,꼬맹이(yoy5****),현빈 넘멋져요~~유쾌하게 즐겁게관람했어요~~ ,10,3,1,TRUE
5104,17.01.21 20:07,프로필(nbg0****),현빈 유해진 케미 잘 보고갑니다. ,10,3,1,TRUE
5105,17.01.21 20:05,소연(jisy****),재미있어어요 믿고보는 유해진 현빈 ,10,3,1,TRUE
5106,17.01.21 20:04,다야몽(loc4****),재미있게 봤어요~~^^ ,9,3,1,TRUE
5107,17.01.21 20:00,kim(kime****),기대했던거 보다 더 잼있어서 놀랐고 현빈이 더 멋있어져서 두번 놀란 영화였어요~~스트레스가 확~풀렸어요~~^^ ,10,3,1,FALSE
5108,17.01.21 19:54,김가은갈치(dmsr****),와 진짜 영화평점 한번도 쓴적 없는데 이영화는진짜 써야겠다 그냥 최고였음 말이필요없으니까 그냥보시길 다들 ,10,3,1,FALSE
5109,17.01.21 19:52,AA(thsg****),나름 괜찮았던 영화였던거 같음 ,6,3,1,TRUE
5110,17.01.21 19:50,간디(kevi****),"주연배우들의 연기가 리얼하게 잘 표현했으며.연출이 특별히 잘한것 가타.볼만항, ",9,3,1,TRUE
5111,17.01.21 19:49,김희준(qqq4****),와... 진짜 현빈 최고 ,10,3,1,FALSE
5112,17.01.21 19:46,ㅋㅋㅋㅋㅋㅋㅋ(fidh****),윤아랑 유해진 진짜 웃기고 현빈 액션 끝내줌ㅋㅋㅋ ,10,3,1,FALSE
5113,17.01.21 19:34,ㅁㄹ(mona****),재미있었음 하하하하핫 ,10,3,1,TRUE
5114,17.01.21 19:34,ㄱㄴㄷㄹ(limh****),괜찮게 봤소 길케 연기 액션 코믹이 아주 적절히 어울려 있구만 기레 ,10,3,1,TRUE
5115,17.01.21 19:33,최혜정(grac****),액션과 뭉클함..주연배우들의 연기 어느하나 나무랄데없었어요~♡ ,10,3,1,TRUE
5116,17.01.21 19:28,Ssy(ssss****),진짜 내가원래 영화보면 지루해서 중간에맨날조는데 더킹도 보고중간에졸았는데 공조는진짜 한번도안졸고다봄 진짜개꿀잼 유해진 연기개굿 ㅋㅋㅋ 마무리도좋았고 내가영화를보고처음으로7천원이아깝지않다는생각이들었음 진짜꼭봐야되는영화 ,10,3,1,FALSE
5117,17.01.21 19:24,세라핀(happ****),통쾌한 액션깨알같은 유머시간가는 줄 모르고 봤음강추 ,10,3,1,TRUE
5118,17.01.21 17:14,권재원(cryg****),재밋습니다재밋습니다 ,10,3,1,TRUE
5119,17.01.21 15:09,김민정(nunu****),현빈의액션연기를볼수있어서좋았고윤아도재밌었움 ,10,3,1,TRUE
5120,17.01.21 15:08,콩이(hopy****),현빈 연기에 빠져든다 스토리는 뻔했지만 액션연기가 볼만핬던 영화 ,10,3,1,TRUE
5121,17.01.21 15:00,김재영(jyzz****),오랜만에 재밋게본 영화네요 ,9,3,1,TRUE
5122,17.01.21 14:55,룰루(phwo****),정말 긴장감넘치고 재밌는영화! ,10,3,1,FALSE
5123,17.01.21 14:43,꼬붕이(bori****),업그레이드 된 현빈!대사가 빈약해도 액션으로 충분한 커버.리쎌위폰을 좀 모방한듯 하지만...완벽한 창조가 어디 있으랴! ,10,3,1,TRUE
5124,17.01.21 14:40,좋은세상(yjki****),"아들과 같이봤는데, 재미있었습니다.현빈과 유해진 케미가 생각보다 좋았고, 무엇보다 현빈 눈빛이 극 상황에 잘 맞았던것같아요.유해진이야 말할것것도 없고..가족들과 보기 좋을것같아요~ ",9,3,1,TRUE
5125,17.01.21 14:35,이현화(287c****),개재밌고 현빈 개잘생김 ㄷㄷ ,10,3,1,FALSE
5126,17.01.21 14:22,soul(pret****),전반적으로 스토리나 연출이 쫌 허접하긴 함~ 특히 현빈이 남쪽 가족 구하러간다고할때 순순히 보내준 북한간부에서 어이털림 ㅋ ㅋ ,7,3,1,FALSE
5127,17.01.21 14:20,cute****,잘 봤어요 현빈 액션연기가 아주 좋았어요 ,9,3,1,TRUE
5128,17.01.21 14:16,곰(moon****),잘됬너요 감동도있구 연기도좋구요 ,10,3,1,TRUE
5129,17.01.21 14:12,미씸뻑(bdc0****),개잼 졸잼!!! 현빈 너무 잘생기고 유해진 연기도짱!! 너무 재밌어욯ㅎㅎ ,10,3,1,TRUE
5130,17.01.21 13:59,김다희(wlsd****),더킹이랑뭐먼저볼까고민하다가공조봤는데 너무재밌네요ㅎ영화보면서 현빈을몇번을검색했는지ㅜ당분간현빈홀릭일듯요ㅜㅎ강추해요영화 ,10,3,1,FALSE
5131,17.01.21 13:47,상큼해(tuli****),너무  짱  재미있습니다  현빈 진짜 멋있어용 ,10,3,1,TRUE
5132,17.01.21 12:58,진명이의깨끗한중고차(chla****),아쉬운 코미디와 스토리연기력은 나쁘지않으나 유해진의 기존코믹스러움은 찾기어려움 ,6,3,1,FALSE
5133,17.01.21 5:31,안녕(rjm1****),고전적인 마무리와 유치하고 뻔한 결말액션감독은 박수보냅니다 10점만점에 20점근데 스토리. 감독님 좀 아쉽네요마지막에 등대고 앉아서 이야기하는 씬은 왜 만든건가요... 오글뻔한 결말과 예상된 시나리오그러나 액션씬은 최고였음.. 액션씬굿 ,8,3,1,FALSE
5134,17.01.21 3:57,8lac****,재미있음 근데 처음에 윤아가 아내인줄 ㅋ.ㅋ ,8,3,1,FALSE
5135,17.01.20 23:17,tjsd****,돈주고 영화보러와서 자고 갈때도 있어서 돈아까웠는데이영화는 웃으면서 집중있게 봤어요현빈 김주혁 넘 커리스마 넘칩니다 ,9,3,1,FALSE
5136,17.01.20 22:48,sind****,윤아 마지막에 짤린거임? ,8,3,1,TRUE
5137,17.01.20 22:46,epik****,액션 코믹 연기 모두 좋음 ,8,3,1,TRUE
5138,17.01.20 22:28,에스에치얼(h951****),좀 더 긴장감있었으면 좋았을텐데 아쉽 ...현빈 아직 쏴라있네 유해진죠앙 ,7,3,1,TRUE
5139,17.01.20 21:23,asdasf(shak****),저는 남자인데 현빈을 보면서 와와 진짜 액션연기 정말 최고다. 유해진은 역시는역시구나.  두분의 조합 최고였습니다.공조2도 나올것같아 은근 기대를해보게 되네요 ,10,3,1,FALSE
5140,17.01.20 21:19,judi****,재밌게 잘 봤음 간만에 편하게 웃으면서 본영화 윤아는 신의한수 코믹최고 ,10,3,1,FALSE
5141,17.01.20 18:28,배성희(iris****),유해진 연기는 실망시키지않네  박진감있고 재밌다 ,9,3,1,FALSE
5142,17.01.20 17:09,선호렬(sunh****),생각한거 보다 재밌었습니다 가족끼리 가볍게 웃으며 보기에 좋았던 영화예요 ,10,3,1,FALSE
5143,17.01.20 17:08,김연정(dusw****),존잼ㅜㅜㅜㅜ 헌빈 너무멌있다 ,10,3,1,FALSE
5144,17.01.20 17:07,김승호(klad****),추격신과 액션신이 굉장히 인상적! ,9,3,1,FALSE
5145,17.01.20 17:06,sadu****,보다 보면 나도 모르게 빠져 있음… ,9,3,1,FALSE
5146,17.01.20 17:01,bgh0****,과하지 않은 적당한 액션과 적당한 코미디가 잘어우러진 작품 ,10,3,1,FALSE
5147,17.01.20 16:58,tnsd****,지루하지않고 재미있게 봤습니다   현빈이랑 김주혁이 멋있네요~ ,10,3,1,FALSE
5148,17.01.20 16:57,박두환(dalg****),현빈이 보여주는 액션은 정말 넘 멋스러웠당 흐흐 ,10,3,1,FALSE
5149,17.01.20 16:53,부메랑on1(ahrz****),재미 웃음 감동 액션을 모두 볼 수 있는 영화!! ,10,3,1,FALSE
5150,17.01.20 16:50,센스쟈니(als7****),현빈씨랑 김주혁씨 왜캐 매력적이세요! ,9,3,1,FALSE
5151,17.01.20 16:49,에퍼용지(sks0****),가볍게 보기 좋았던 멋있었던 영화 공조 ,10,3,1,FALSE
5152,17.01.20 16:48,molk****,현빈의 액션에 유해진의 코믹이 가미되어 시간 가는줄 모르고 빠져들었네요 ,10,3,1,FALSE
5153,17.01.20 16:10,dudg****,김주혁의 연기가 좋았다. ,8,3,1,FALSE
5154,17.01.20 16:09,꽁치(xodi****),구탱이형 김주혁의 재발견ㅋㅋㅋ 악역연기 개쩔었다 진심 ,10,3,1,FALSE
5155,17.01.20 16:03,나다(leey****),현빈 잘생겼더라....구탱이형도 연기변신 놀람!! ,10,3,1,FALSE
5157,17.01.20 15:53,레용레용레용레용RAY(kss8****),가볍게 즐겁게 볼 수 있는 영화 탄생! ,10,3,1,FALSE
5158,17.01.20 15:51,블루크레인(sang****),현빈과 유해진 형사역할 너무멋졌다! 북한간첩과 일반남한인의 호흡맞는 연기! 보면볼수록 멋졌고 영화에 나도모르게 빠져들었다! 영화도 재미있게 잘봤다! 빨리남한과 북한이 통일되어서 서로 소중한걸 지켜주는 한민족나라국가가 하루빨리 오길! ,10,3,1,FALSE
5159,17.01.20 15:51,햇사리(staf****),액션이 너무 빨라서 순식간에 지나감...액션씬 다시보러 다시 극장가야할듯... 무튼 엄청 고생했겠다는 생각이 ... ,10,3,1,FALSE
5160,17.01.20 15:49,clou****,액션의 스릴감과 긴장감도 느낄 수 있었고 거기다가 코믹함까지 있으니 재미없을리가 없잖아 ,10,3,1,FALSE
5161,17.01.20 15:47,skil****,믿고 보는 배우 유핸진♥ 공조 영화 넘나 꿀잼♥ ,9,3,1,FALSE
5162,17.01.20 15:46,kimz****,주연들뿐 아니라 조연들까지도 돋보이는 작품ㅋㅋ 하나같이 캐릭터 소화력들이 굳 ,9,3,1,FALSE
5163,17.01.20 15:30,뿌뿌(kye5****),현빈이 너무 머싯다 강소라 부럽다.. ,10,3,1,FALSE
5164,17.01.20 15:18,jkm5****,북한의 실상과 우리나라의 현재 모습을 조금은 알 수 있었던 영화라고 생각합니당 오랜만에 웃음 많은 영화 잘보고왔어요^^ ,10,3,1,FALSE
5165,17.01.20 15:17,매력적인배군(junu****),현빈 액션연기 처음이라고 하던데 전혀 처음 같지 않았다 ,10,3,1,FALSE
5166,17.01.20 14:30,nmk9****,영화에서 제일 중요한 스토리 연기 연출 삼박자 다 갖춘 영화임 ,10,3,1,FALSE
